{
  "operation_id": "artifact-operation-unknown-1",
  "attempt_id": "artifact-attempt-unknown-1",
  "fencing_token": 4,
  "sandbox_id": "sandbox-1",
  "type": "artifact_stage",
  "status": "outcome_unknown",
  "provider_operation_id": "artifact-operation-unknown-1",
  "error": {
    "code": "SANDBOX_ARTIFACT_OUTCOME_UNKNOWN",
    "message": "artifact staging outcome requires reconciliation",
    "retryable": true,
    "outcome": "outcome_unknown"
  },
  "observed_at": "2026-08-25T11:58:00Z"
}
