{
  "operation_id": "operation-exec-1",
  "attempt_id": "attempt-exec-1",
  "fencing_token": 1,
  "sandbox_id": "sandbox-1",
  "type": "exec",
  "status": "accepted",
  "provider_operation_id": "provider-operation-exec-1",
  "result_reference": "ref:exec/result-1",
  "observed_at": "2026-08-21T00:00:01Z"
}
